{"schema_version":"market-data-provider-revision/1.0.0","revision_id":"a07afe299516b8901989a0a1496a07f10e9c33909277164e6bcd5741e0c98b21","classification":"PROVIDER_REVISABLE_SNAPSHOT","effective_timestamp":1787578500000,"known_at_utc":"2026-08-24T14:21:25.047Z","provider":"kraken-futures","instrument":"PI_XBTUSD","metric":"future-basis","previous_value_fingerprint":"49c534f22269caee8cf83e1b4be5eb9084a236fd48240cc795bbac78652cc7a2","observed_value":[1787578500000,{"basis":"-0.0000"}],"source_snapshot_ref":"derivatives/revisions/source/2026/08/24/kraken-futures/PI_XBTUSD-future-basis-1787581285047.json","revision_of":"kraken-futures/PI_XBTUSD/future-basis/1787578500000"}
