{"schema_version":"market-data-provider-revision/1.0.0","revision_id":"2a9902bf5cf910488c3d3276a305472e6ae2065268f42463f62ec85d54def7fd","classification":"PROVIDER_REVISABLE_SNAPSHOT","effective_timestamp":1787584200000,"known_at_utc":"2026-08-24T19:12:02.465Z","provider":"kraken-futures","instrument":"PI_XBTUSD","metric":"funding","previous_value_fingerprint":"166d754b335808e66be2ca377691e69706556f2340e999f80adaf32c55b49849","observed_value":[1787584200000,{"rate":["-0.000000000114621745","-0.000000000114621745","-0.000000000114621745","-0.000000000114621745"],"relativeRate":["-0.000009110720833333","-0.000009110720833333","-0.000009110720833333","-0.000009110720833333"]}],"source_snapshot_ref":"derivatives/revisions/source/2026/08/24/kraken-futures/PI_XBTUSD-funding-1787598722465.json","revision_of":"kraken-futures/PI_XBTUSD/funding/1787584200000"}
