{"schema_version":"market-data-provider-revision/1.0.0","revision_id":"e53b1b1c7f49f9cf99f667077166a3fe188e90c75a41ff7ec48ff246564782e7","classification":"PROVIDER_REVISABLE_SNAPSHOT","effective_timestamp":1791905100000,"known_at_utc":"2026-10-13T17:37:15.949Z","provider":"kraken-futures","instrument":"PI_ETHUSD","metric":"funding","previous_value_fingerprint":"3d64350bde711858be1cca2747417b26b95a174b735ba47b94b7c59cc2f68665","observed_value":[1791905100000,{"rate":["0.000000024952329944","0.000000024952329944","0.000000024952329944","0.000000024952329944"],"relativeRate":["0.000062739888888889","0.000062739888888889","0.000062739888888889","0.000062739888888889"]}],"source_snapshot_ref":"derivatives/revisions/source/2026/10/13/kraken-futures/PI_ETHUSD-funding-1791913035949.json","revision_of":"kraken-futures/PI_ETHUSD/funding/1791905100000"}
