{"schema_version":"market-data-provider-revision/1.0.0","revision_id":"8f21f520bf93310f5056bcdf7ee8862f98d11fc1a03c7f9acd749b8a476dcd81","classification":"PROVIDER_REVISABLE_SNAPSHOT","effective_timestamp":1787582100000,"known_at_utc":"2026-08-24T19:12:02.465Z","provider":"kraken-futures","instrument":"PI_ETHUSD","metric":"future-basis","previous_value_fingerprint":"7d3c756d6735b2a53f3d8aa0181123d2d83bb9dfeff70c2f5a14036818be5132","observed_value":[1787582100000,{"basis":"-0.0081"}],"source_snapshot_ref":"derivatives/revisions/source/2026/08/24/kraken-futures/PI_ETHUSD-future-basis-1787598722465.json","revision_of":"kraken-futures/PI_ETHUSD/future-basis/1787582100000"}
