{"schema_version":"market-data-provider-revision/1.0.0","revision_id":"6795753f99c030b82f705a95a0f5895dd4ab710c135a4a5daeb7728b31414abf","classification":"PROVIDER_REVISABLE_SNAPSHOT","effective_timestamp":1787582400000,"known_at_utc":"2026-08-24T19:12:02.465Z","provider":"kraken-futures","instrument":"PI_ETHUSD","metric":"future-basis","previous_value_fingerprint":"f150a99286992717a186881cd2e4b3438e5ac98ac6a286da64ef308b5bb5e8dd","observed_value":[1787582400000,{"basis":"0.0000"}],"source_snapshot_ref":"derivatives/revisions/source/2026/08/24/kraken-futures/PI_ETHUSD-future-basis-1787598722465.json","revision_of":"kraken-futures/PI_ETHUSD/future-basis/1787582400000"}
