{"schema_version":"market-data-provider-revision/1.0.0","revision_id":"cff4755d584a1d7f8dade65fd310f29361299767456d88cb95abefc9ca053df1","classification":"PROVIDER_REVISABLE_SNAPSHOT","effective_timestamp":1787586000000,"known_at_utc":"2026-08-24T17:07:42.025Z","provider":"kraken-futures","instrument":"PI_XBTUSD","metric":"future-basis","previous_value_fingerprint":"4baba8ec3f254218f1ffb4abee3523b9e888683cefb7f7a2705800e1c6880535","observed_value":[1787586000000,{"basis":"-0.0000"}],"source_snapshot_ref":"derivatives/revisions/source/2026/08/24/kraken-futures/PI_XBTUSD-future-basis-1787591262025.json","revision_of":"kraken-futures/PI_XBTUSD/future-basis/1787586000000"}
