{"schema_version":"market-data-provider-revision/1.0.0","revision_id":"8a815894acf8d5b974253918e4d94bfb427505a5c544e0bbd4733db1b93063c4","classification":"PROVIDER_REVISABLE_SNAPSHOT","effective_timestamp":1787576700000,"known_at_utc":"2026-08-24T14:21:25.047Z","provider":"kraken-futures","instrument":"PI_XBTUSD","metric":"future-basis","previous_value_fingerprint":"fa811b2155a74a28666583b11788c3594ac2bcf2ed6282d653b6acfbbddb7922","observed_value":[1787576700000,{"basis":"-0.0000"}],"source_snapshot_ref":"derivatives/revisions/source/2026/08/24/kraken-futures/PI_XBTUSD-future-basis-1787581285047.json","revision_of":"kraken-futures/PI_XBTUSD/future-basis/1787576700000"}
